{
  "name": "my-config",
  "description": "My code security configuration",
  "code_security": "disabled",
  "secret_protection": "enabled",
  "dependency_graph": "enabled",
  "dependency_graph_autosubmit_action": "enabled",
  "dependency_graph_autosubmit_action_labeled_runners": true,
  "dependabot_alerts": "enabled",
  "dependabot_security_updates": "enabled",
  "dependabot_reachability": null,
  "dependabot_delegated_alert_dismissal": "disabled",
  "code_scanning_default_setup": "disabled",
  "code_scanning_default_setup_runner_type": "labeled",
  "code_scanning_default_setup_runner_label": "code-scanning",
  "code_scanning_allow_advanced": false,
  "code_scanning_delegated_alert_dismissal": "not_set",
  "secret_scanning": "enabled",
  "secret_scanning_push_protection": "enabled",
  "secret_scanning_delegated_bypass": "enabled",
  "secret_scanning_delegated_bypass_reviewers": [
    "@OtterdogTest/security-team",
    "#RepositoryAdmin",
    "#4711:exempt"
  ],
  "secret_scanning_validity_checks": "enabled",
  "secret_scanning_non_provider_patterns": "enabled",
  "secret_scanning_generic_secrets": "disabled",
  "secret_scanning_generic_secrets_push_protection": "disabled",
  "secret_scanning_delegated_alert_dismissal": "disabled",
  "secret_scanning_extended_metadata": "disabled",
  "private_vulnerability_reporting": "enabled",
  "enforcement": "enforced",
  "default_for_new_repos": "private_and_internal"
}
